<?xml version='1.0' encoding='ISO-8859-1' standalone='no'?>

<Programacion
        xmlns="http://www.w3schools.com"
        xmlns:xsi="http://www.w3.org/2001/XMLSchema-instance"
        xsi:schemaLocation="http://localhost:8024/lro24/tvml14.xsd">

    <Fecha>23/12/2001</Fecha>

    <Canal lang='es'>
        <NombreCanal>Cuatro</NombreCanal>
        <Programa edadminima='12'>
            Hazlo tu mismo 2
            <NombrePrograma>Bricomania</NombrePrograma>
            <Categoria>Documentales</Categoria>
            <Intervalo>
                <HoraInicio>19:00</HoraInicio>
                <HoraFin>20:00</HoraFin>
            </Intervalo>
        </Programa>
    </Canal>

    <Canal lang='en' teletexto='si'>
        <NombreCanal>HBO</NombreCanal>
        <Formato>16:9</Formato>
        <Programa edadminima='3' langs='es'>
            <NombrePrograma>Game of Thrones</NombrePrograma>
            <Categoria>Cine</Categoria>
            <Intervalo>
                <HoraInicio>15:00</HoraInicio>
                <HoraFin>16:00</HoraFin>
            </Intervalo>
        </Programa>
        <Programa edadminima='8' langs='es en de'>
            <NombrePrograma>Vikingos</NombrePrograma>
            <Categoria>Cine</Categoria>
            <Intervalo>
                <HoraInicio>20:00</HoraInicio>
                <Duracion>75</Duracion>
            </Intervalo>
        </Programa>
    </Canal>

    <Canal lang='it' teletexto='si'>
        <NombreCanal>Discovery Max</NombreCanal>
        <Formato>4:3</Formato>
        <Programa edadminima='8' langs='en es it'>
            <NombrePrograma>Joyas Sobre Ruedas</NombrePrograma>
            <Categoria>Documentales</Categoria>
            <Intervalo>
                <HoraInicio>11:00</HoraInicio>
                <HoraFin>13:00</HoraFin>
            </Intervalo>
            Ford Capri
        </Programa>
    </Canal>
</Programacion>