<?xml version='1.0' encoding='ISO-8859-1' standalone='no'?>

<Programacion
        xmlns="http://www.w3schools.com"
        xmlns:xsi="http://www.w3.org/2001/XMLSchema-instance"
        xsi:schemaLocation="http://localhost:8024/lro24/tvml14.xsd">

    <Fecha>17/12/2001</Fecha>

    <Canal lang='en' teletexto='si'>
        <NombreCanal>HBO</NombreCanal>
        <Formato>16:9</Formato>
        <Programa edadminima='3' langs='es'>
            <NombrePrograma>Game of Thrones</NombrePrograma>
            <Categoria>Cine</Categoria>
            <Intervalo>
                <HoraInicio>15:00</HoraInicio>
                <HoraFin>16:00</HoraFin>
            </Intervalo>
        </Programa>
    </Canal>
</Programacion>